{
  "$schema": "../schemas/promotion-candidate.schema.json",
  "schema_version": "1.0.0",
  "promotion_receipt_id": "RCP-COMPARATIVE-PROMOTION-004",
  "repository": "driftframestudios/lims-eln-comparative-evidence",
  "target_release": "comparison-v0.3.2",
  "promotion_state": "candidate_ready",
  "release_event_evidence": {
    "evidence_mode": "planned",
    "assurance_stage": "specified"
  },
  "comparison_authority": {
    "evidence_mode": "simulated",
    "assurance_stage": "verified",
    "comparison_mode": "simulated_verification",
    "environment_observed_closure": "separate_unasserted_state",
    "production_authorization_effect": "none"
  },
  "candidate_coordinate": {
    "release": "candidate-comparison-v0.3.2",
    "repository_release": "0.3.2",
    "constellation_lock": "constellation.lock.json",
    "constellation_lock_canonical_json_digest": "sha256:a0f5a59dc032b7771e1c90b42942e7ac0a5a894fbc989fd14cadc42a8d81608e",
    "synthetic_contract_report_digest": "sha256:5f66ed1a3023b00bc7779f8810c0440f594dd5fe10e90a475b073eaa438f741b",
    "golden_specimen_report_digest": "sha256:a2f92ae4acb9fb7d835d0a9b126bb1932ae69b06b094303180dd9fea7217b77c",
    "golden_source_constellation_digest": "sha256:6547340f075d5ab60a767ba32f1584054c30edf839239e196748a68118c641e2"
  },
  "prior_release_coordinate": {
    "promotion_receipt": "receipts/promotion-receipt.json",
    "promotion_receipt_file_sha256": "sha256:733261cf52339f7f6b3e650302ab4b8b51c37eef57c752b0f5e2d2c4e27485ff",
    "tag": "comparison-v0.3.1",
    "tag_object_oid": "4c29f6ca410eb4400c55ad77fc34ada2960d1972",
    "commit_oid": "b5c13689a32739d29437e209816bf0cd6a878976",
    "tree_oid": "10a784b8a677ee6eb524d2860ff5ee7151d6050b",
    "archive_digest": "sha256:92c2d57bd9e75c650365db4b481a22a6580b201926ba1c666fcf8cb8c9311a2e"
  },
  "required_evidence": [
    "Enterprise v0.3.2 carries the accepted signed tag, commit, tree, archive, and release-observation coordinates.",
    "The Enterprise source advance changes the observation lineage while its complete result, projection, producer detail, and provenance remain byte-identical; the ordered 17 compared paths and their classifications are identical to the 0.3.1 comparison.",
    "The deterministic repository check reproduces the 0.3.2 contract-shape and Golden Specimen report bundles from their exact source inputs.",
    "The signed comparison-v0.3.1 release and its published Pages projection remain independently recoverable as the prior public baseline."
  ],
  "remaining_promotion_evidence": [
    "Review and merge the exact comparison candidate through the repository branch controls.",
    "Create and verify the signed annotated comparison-v0.3.2 tag at the accepted release commit.",
    "Record the release object, archive, hosted checks, and review boundary in a successor observation receipt.",
    "Build and observe the deterministic docs projection from an accepted main source carrier."
  ],
  "limitations": [
    "The signed comparison-v0.3.2 tag and its Git object coordinates will establish immutable release identity.",
    "A tag-to-tag Git tree comparison found identical blobs in the Enterprise database, SQL, fixture, PostgreSQL adapter, service, and domain paths. The earlier hosted proof continues to cover those paths, and the accepted v0.3.2 shared-contract source establishes the updated implementation coordinate."
  ],
  "accountable_role": "Comparative evidence release stewardship"
}
